{
  "format": "dungeon-scrivener-engine-inputs",
  "schemaVersion": 1,
  "sessionStart": {
    "randomSeed": 17,
    "wallClockEpochMilliseconds": 1000000,
    "visibility": "visible",
    "focused": true
  },
  "clockInput": {
    "kind": "resume",
    "wallClockEpochMilliseconds": 1360000,
    "visibility": "visible",
    "focused": true
  },
  "playerInput": {
    "kind": "command-text",
    "rawText": "COUNT CANDLES 3"
  }
}
